📝 Logging to: logs/train_2025-11-11_10-04-18.log


🖼️ Loaded 81444 total images across 27 classes.

📊 Data split summary:
   ➤ Total images: 81444
   ➤ Classes: 27
   ➤ Train: 58842
   ➤ Val:   10385
   ➤ Test:  12217


==============================
🚀 Starting ResNet50 | IMG=224 | Batch=16 | LR=2e-05 | Epochs=40
==============================

[ResNet50] Epoch 1: TrainAcc=0.371 | ValAcc=0.424 | TrainLoss=1.8160 | ValLoss=1.6480 | F1=0.399
✅ Best ResNet50 model saved (F1=0.399)!
[ResNet50] Epoch 2: TrainAcc=0.492 | ValAcc=0.486 | TrainLoss=1.3283 | ValLoss=1.4829 | F1=0.476
✅ Best ResNet50 model saved (F1=0.476)!
[ResNet50] Epoch 3: TrainAcc=0.543 | ValAcc=0.484 | TrainLoss=1.1468 | ValLoss=1.4805 | F1=0.473
[ResNet50] Epoch 4: TrainAcc=0.578 | ValAcc=0.531 | TrainLoss=1.0312 | ValLoss=1.4310 | F1=0.512
✅ Best ResNet50 model saved (F1=0.512)!
[ResNet50] Epoch 5: TrainAcc=0.611 | ValAcc=0.534 | TrainLoss=0.9358 | ValLoss=1.3965 | F1=0.517
✅ Best ResNet50 model saved (F1=0.517)!
[ResNet50] Epoch 6: TrainAcc=0.636 | ValAcc=0.552 | TrainLoss=0.8593 | ValLoss=1.3767 | F1=0.538
✅ Best ResNet50 model saved (F1=0.538)!
[ResNet50] Epoch 7: TrainAcc=0.653 | ValAcc=0.553 | TrainLoss=0.8025 | ValLoss=1.4196 | F1=0.533
[ResNet50] Epoch 8: TrainAcc=0.671 | ValAcc=0.544 | TrainLoss=0.7487 | ValLoss=1.4576 | F1=0.535
[ResNet50] Epoch 9: TrainAcc=0.685 | ValAcc=0.564 | TrainLoss=0.7054 | ValLoss=1.4611 | F1=0.555
✅ Best ResNet50 model saved (F1=0.555)!
[ResNet50] Epoch 10: TrainAcc=0.701 | ValAcc=0.559 | TrainLoss=0.6625 | ValLoss=1.4979 | F1=0.534
[ResNet50] Epoch 11: TrainAcc=0.711 | ValAcc=0.578 | TrainLoss=0.6348 | ValLoss=1.4470 | F1=0.561
✅ Best ResNet50 model saved (F1=0.561)!
[ResNet50] Epoch 12: TrainAcc=0.728 | ValAcc=0.570 | TrainLoss=0.5929 | ValLoss=1.5198 | F1=0.548
[ResNet50] Epoch 13: TrainAcc=0.735 | ValAcc=0.577 | TrainLoss=0.5691 | ValLoss=1.5144 | F1=0.555
[ResNet50] Epoch 14: TrainAcc=0.743 | ValAcc=0.582 | TrainLoss=0.5463 | ValLoss=1.4912 | F1=0.568
✅ Best ResNet50 model saved (F1=0.568)!
[ResNet50] Epoch 15: TrainAcc=0.751 | ValAcc=0.584 | TrainLoss=0.5207 | ValLoss=1.5427 | F1=0.574
✅ Best ResNet50 model saved (F1=0.574)!
[ResNet50] Epoch 16: TrainAcc=0.760 | ValAcc=0.580 | TrainLoss=0.5029 | ValLoss=1.5969 | F1=0.563
[ResNet50] Epoch 17: TrainAcc=0.766 | ValAcc=0.580 | TrainLoss=0.4842 | ValLoss=1.5826 | F1=0.561
[ResNet50] Epoch 18: TrainAcc=0.777 | ValAcc=0.580 | TrainLoss=0.4615 | ValLoss=1.6202 | F1=0.576
✅ Best ResNet50 model saved (F1=0.576)!
[ResNet50] Epoch 19: TrainAcc=0.780 | ValAcc=0.592 | TrainLoss=0.4516 | ValLoss=1.5624 | F1=0.579
✅ Best ResNet50 model saved (F1=0.579)!
[ResNet50] Epoch 20: TrainAcc=0.791 | ValAcc=0.587 | TrainLoss=0.4276 | ValLoss=1.6431 | F1=0.574
[ResNet50] Epoch 21: TrainAcc=0.795 | ValAcc=0.590 | TrainLoss=0.4211 | ValLoss=1.6616 | F1=0.573
[ResNet50] Epoch 22: TrainAcc=0.800 | ValAcc=0.584 | TrainLoss=0.4077 | ValLoss=1.7033 | F1=0.572
[ResNet50] Epoch 23: TrainAcc=0.805 | ValAcc=0.586 | TrainLoss=0.3942 | ValLoss=1.7004 | F1=0.578
[ResNet50] Epoch 24: TrainAcc=0.815 | ValAcc=0.591 | TrainLoss=0.3752 | ValLoss=1.7137 | F1=0.582
✅ Best ResNet50 model saved (F1=0.582)!
[ResNet50] Epoch 25: TrainAcc=0.817 | ValAcc=0.590 | TrainLoss=0.3665 | ValLoss=1.7143 | F1=0.580
[ResNet50] Epoch 26: TrainAcc=0.845 | ValAcc=0.604 | TrainLoss=0.3034 | ValLoss=1.6737 | F1=0.597
✅ Best ResNet50 model saved (F1=0.597)!
[ResNet50] Epoch 27: TrainAcc=0.853 | ValAcc=0.605 | TrainLoss=0.2819 | ValLoss=1.7172 | F1=0.598
✅ Best ResNet50 model saved (F1=0.598)!
[ResNet50] Epoch 28: TrainAcc=0.859 | ValAcc=0.605 | TrainLoss=0.2726 | ValLoss=1.7355 | F1=0.593
[ResNet50] Epoch 29: TrainAcc=0.864 | ValAcc=0.599 | TrainLoss=0.2627 | ValLoss=1.7863 | F1=0.590
[ResNet50] Epoch 30: TrainAcc=0.868 | ValAcc=0.607 | TrainLoss=0.2511 | ValLoss=1.7754 | F1=0.597
[ResNet50] Epoch 31: TrainAcc=0.871 | ValAcc=0.610 | TrainLoss=0.2452 | ValLoss=1.8341 | F1=0.595
[ResNet50] Epoch 32: TrainAcc=0.875 | ValAcc=0.603 | TrainLoss=0.2400 | ValLoss=1.7801 | F1=0.595
[ResNet50] Epoch 33: TrainAcc=0.880 | ValAcc=0.603 | TrainLoss=0.2277 | ValLoss=1.8182 | F1=0.594
[ResNet50] Epoch 34: TrainAcc=0.882 | ValAcc=0.602 | TrainLoss=0.2223 | ValLoss=1.8616 | F1=0.600
✅ Best ResNet50 model saved (F1=0.600)!
[ResNet50] Epoch 35: TrainAcc=0.883 | ValAcc=0.604 | TrainLoss=0.2198 | ValLoss=1.8648 | F1=0.600
[ResNet50] Epoch 36: TrainAcc=0.891 | ValAcc=0.605 | TrainLoss=0.2106 | ValLoss=1.8636 | F1=0.596
[ResNet50] Epoch 37: TrainAcc=0.891 | ValAcc=0.609 | TrainLoss=0.2070 | ValLoss=1.8787 | F1=0.598
[ResNet50] Epoch 38: TrainAcc=0.903 | ValAcc=0.614 | TrainLoss=0.1868 | ValLoss=1.8788 | F1=0.600
[ResNet50] Epoch 39: TrainAcc=0.907 | ValAcc=0.615 | TrainLoss=0.1769 | ValLoss=1.8930 | F1=0.603
✅ Best ResNet50 model saved (F1=0.603)!
[ResNet50] Epoch 40: TrainAcc=0.910 | ValAcc=0.615 | TrainLoss=0.1714 | ValLoss=1.8844 | F1=0.604
✅ Best ResNet50 model saved (F1=0.604)!
🎯 Best ResNet50 ValAcc: 0.615|ValF1: 0.604

==============================
📊 MODEL EVALUATION SUMMARY
==============================
✅ Accuracy:       0.6126
❌ Error Rate:     0.3874
🎯 Macro F1:       0.6103
📦 Weighted F1:    0.6097
✨ Macro Precision: 0.6214
✨ Weighted Prec.:  0.6110
📈 Macro Recall:    0.6079
📈 Weighted Recall: 0.6126
🧮 Confusion Matrix: (27, 27)
==============================

                            precision    recall  f1-score   support

    Abstract_Expressionism       0.58      0.62      0.60       417
           Action_painting       0.54      0.47      0.50        15
         Analytical_Cubism       0.81      0.76      0.79        17
        Art_Nouveau_Modern       0.59      0.60      0.59       650
                   Baroque       0.67      0.76      0.71       636
      Color_Field_Painting       0.71      0.68      0.69       242
      Contemporary_Realism       0.76      0.43      0.55        72
                    Cubism       0.53      0.65      0.58       335
         Early_Renaissance       0.65      0.70      0.67       209
             Expressionism       0.48      0.51      0.49      1010
                   Fauvism       0.41      0.30      0.35       140
          High_Renaissance       0.58      0.54      0.56       201
             Impressionism       0.68      0.74      0.71      1959
Mannerism_Late_Renaissance       0.70      0.60      0.65       192
                Minimalism       0.61      0.69      0.64       201
     Naive_Art_Primitivism       0.65      0.56      0.60       361
               New_Realism       0.35      0.23      0.28        47
      Northern_Renaissance       0.77      0.79      0.78       383
               Pointillism       0.61      0.70      0.65        77
                   Pop_Art       0.62      0.61      0.61       223
        Post_Impressionism       0.54      0.41      0.47       968
                   Realism       0.59      0.56      0.58      1610
                    Rococo       0.75      0.68      0.71       313
               Romanticism       0.60      0.62      0.61      1053
                 Symbolism       0.51      0.52      0.51       679
          Synthetic_Cubism       0.60      0.75      0.67        32
                   Ukiyo_e       0.89      0.93      0.91       175

                  accuracy                           0.61     12217
                 macro avg       0.62      0.61      0.61     12217
              weighted avg       0.61      0.61      0.61     12217


==============================
🚀 Starting EfficientNetB0 | IMG=224 | Batch=16 | LR=0.0001 | Epochs=50
==============================

[EfficientNetB0] Epoch 1: TrainAcc=0.392 | ValAcc=0.467 | TrainLoss=1.7388 | ValLoss=1.4920 | F1=0.446
✅ Best EfficientNetB0 model saved (F1=0.446)!
[EfficientNetB0] Epoch 2: TrainAcc=0.513 | ValAcc=0.497 | TrainLoss=1.2475 | ValLoss=1.4123 | F1=0.481
✅ Best EfficientNetB0 model saved (F1=0.481)!
[EfficientNetB0] Epoch 3: TrainAcc=0.567 | ValAcc=0.534 | TrainLoss=1.0644 | ValLoss=1.3509 | F1=0.525
✅ Best EfficientNetB0 model saved (F1=0.525)!
[EfficientNetB0] Epoch 4: TrainAcc=0.602 | ValAcc=0.545 | TrainLoss=0.9518 | ValLoss=1.3481 | F1=0.522
[EfficientNetB0] Epoch 5: TrainAcc=0.630 | ValAcc=0.549 | TrainLoss=0.8660 | ValLoss=1.3440 | F1=0.533
✅ Best EfficientNetB0 model saved (F1=0.533)!
[EfficientNetB0] Epoch 6: TrainAcc=0.653 | ValAcc=0.547 | TrainLoss=0.8020 | ValLoss=1.3546 | F1=0.537
✅ Best EfficientNetB0 model saved (F1=0.537)!
[EfficientNetB0] Epoch 7: TrainAcc=0.672 | ValAcc=0.574 | TrainLoss=0.7380 | ValLoss=1.3548 | F1=0.564
✅ Best EfficientNetB0 model saved (F1=0.564)!
[EfficientNetB0] Epoch 8: TrainAcc=0.690 | ValAcc=0.578 | TrainLoss=0.6904 | ValLoss=1.3996 | F1=0.558
[EfficientNetB0] Epoch 9: TrainAcc=0.701 | ValAcc=0.580 | TrainLoss=0.6525 | ValLoss=1.3874 | F1=0.560
[EfficientNetB0] Epoch 10: TrainAcc=0.716 | ValAcc=0.579 | TrainLoss=0.6130 | ValLoss=1.4360 | F1=0.567
✅ Best EfficientNetB0 model saved (F1=0.567)!
[EfficientNetB0] Epoch 11: TrainAcc=0.728 | ValAcc=0.585 | TrainLoss=0.5788 | ValLoss=1.4567 | F1=0.569
✅ Best EfficientNetB0 model saved (F1=0.569)!
[EfficientNetB0] Epoch 12: TrainAcc=0.738 | ValAcc=0.584 | TrainLoss=0.5507 | ValLoss=1.4709 | F1=0.585
✅ Best EfficientNetB0 model saved (F1=0.585)!
[EfficientNetB0] Epoch 13: TrainAcc=0.747 | ValAcc=0.595 | TrainLoss=0.5299 | ValLoss=1.4838 | F1=0.576
[EfficientNetB0] Epoch 14: TrainAcc=0.757 | ValAcc=0.590 | TrainLoss=0.5094 | ValLoss=1.5488 | F1=0.578
[EfficientNetB0] Epoch 15: TrainAcc=0.764 | ValAcc=0.579 | TrainLoss=0.4875 | ValLoss=1.5561 | F1=0.582
[EfficientNetB0] Epoch 16: TrainAcc=0.774 | ValAcc=0.593 | TrainLoss=0.4728 | ValLoss=1.5520 | F1=0.574
[EfficientNetB0] Epoch 17: TrainAcc=0.780 | ValAcc=0.592 | TrainLoss=0.4530 | ValLoss=1.5787 | F1=0.587
✅ Best EfficientNetB0 model saved (F1=0.587)!
[EfficientNetB0] Epoch 18: TrainAcc=0.785 | ValAcc=0.587 | TrainLoss=0.4397 | ValLoss=1.5851 | F1=0.580
[EfficientNetB0] Epoch 19: TrainAcc=0.790 | ValAcc=0.597 | TrainLoss=0.4278 | ValLoss=1.6537 | F1=0.577
[EfficientNetB0] Epoch 20: TrainAcc=0.800 | ValAcc=0.596 | TrainLoss=0.4048 | ValLoss=1.6098 | F1=0.581
[EfficientNetB0] Epoch 21: TrainAcc=0.804 | ValAcc=0.595 | TrainLoss=0.3965 | ValLoss=1.6941 | F1=0.581
[EfficientNetB0] Epoch 22: TrainAcc=0.808 | ValAcc=0.597 | TrainLoss=0.3837 | ValLoss=1.7037 | F1=0.576
[EfficientNetB0] Epoch 23: TrainAcc=0.813 | ValAcc=0.597 | TrainLoss=0.3766 | ValLoss=1.7410 | F1=0.585
[EfficientNetB0] Epoch 24: TrainAcc=0.820 | ValAcc=0.600 | TrainLoss=0.3643 | ValLoss=1.7199 | F1=0.582
[EfficientNetB0] Epoch 25: TrainAcc=0.822 | ValAcc=0.599 | TrainLoss=0.3581 | ValLoss=1.7525 | F1=0.588
✅ Best EfficientNetB0 model saved (F1=0.588)!
[EfficientNetB0] Epoch 26: TrainAcc=0.828 | ValAcc=0.607 | TrainLoss=0.3483 | ValLoss=1.7334 | F1=0.601
✅ Best EfficientNetB0 model saved (F1=0.601)!
[EfficientNetB0] Epoch 27: TrainAcc=0.830 | ValAcc=0.601 | TrainLoss=0.3414 | ValLoss=1.8003 | F1=0.592
[EfficientNetB0] Epoch 28: TrainAcc=0.833 | ValAcc=0.600 | TrainLoss=0.3309 | ValLoss=1.7930 | F1=0.601
✅ Best EfficientNetB0 model saved (F1=0.601)!
[EfficientNetB0] Epoch 29: TrainAcc=0.835 | ValAcc=0.601 | TrainLoss=0.3227 | ValLoss=1.7629 | F1=0.591
[EfficientNetB0] Epoch 30: TrainAcc=0.841 | ValAcc=0.611 | TrainLoss=0.3166 | ValLoss=1.7816 | F1=0.595
[EfficientNetB0] Epoch 31: TrainAcc=0.849 | ValAcc=0.602 | TrainLoss=0.3037 | ValLoss=1.8263 | F1=0.590
[EfficientNetB0] Epoch 32: TrainAcc=0.850 | ValAcc=0.603 | TrainLoss=0.2968 | ValLoss=1.8748 | F1=0.588
[EfficientNetB0] Epoch 33: TrainAcc=0.851 | ValAcc=0.591 | TrainLoss=0.2966 | ValLoss=1.9221 | F1=0.576
[EfficientNetB0] Epoch 34: TrainAcc=0.856 | ValAcc=0.609 | TrainLoss=0.2821 | ValLoss=1.8381 | F1=0.596
[EfficientNetB0] Epoch 35: TrainAcc=0.857 | ValAcc=0.600 | TrainLoss=0.2842 | ValLoss=1.9040 | F1=0.588
[EfficientNetB0] Epoch 36: TrainAcc=0.862 | ValAcc=0.608 | TrainLoss=0.2708 | ValLoss=1.9920 | F1=0.594
⏹️ Early stopping (no F1 improvement).
🎯 Best EfficientNetB0 ValAcc: 0.608|ValF1: 0.601

==============================
📊 MODEL EVALUATION SUMMARY
==============================
✅ Accuracy:       0.5984
❌ Error Rate:     0.4016
🎯 Macro F1:       0.5951
📦 Weighted F1:    0.5999
✨ Macro Precision: 0.5904
✨ Weighted Prec.:  0.6074
📈 Macro Recall:    0.6084
📈 Weighted Recall: 0.5984
🧮 Confusion Matrix: (27, 27)
==============================

                            precision    recall  f1-score   support

    Abstract_Expressionism       0.58      0.64      0.61       417
           Action_painting       0.53      0.60      0.56        15
         Analytical_Cubism       0.70      0.82      0.76        17
        Art_Nouveau_Modern       0.60      0.56      0.58       650
                   Baroque       0.71      0.69      0.70       636
      Color_Field_Painting       0.77      0.67      0.71       242
      Contemporary_Realism       0.55      0.51      0.53        72
                    Cubism       0.43      0.66      0.52       335
         Early_Renaissance       0.62      0.65      0.63       209
             Expressionism       0.50      0.45      0.47      1010
                   Fauvism       0.30      0.34      0.32       140
          High_Renaissance       0.50      0.54      0.52       201
             Impressionism       0.75      0.65      0.69      1959
Mannerism_Late_Renaissance       0.56      0.68      0.62       192
                Minimalism       0.55      0.86      0.67       201
     Naive_Art_Primitivism       0.59      0.64      0.62       361
               New_Realism       0.23      0.26      0.24        47
      Northern_Renaissance       0.88      0.73      0.80       383
               Pointillism       0.62      0.56      0.59        77
                   Pop_Art       0.59      0.41      0.48       223
        Post_Impressionism       0.45      0.47      0.46       968
                   Realism       0.59      0.58      0.58      1610
                    Rococo       0.69      0.76      0.72       313
               Romanticism       0.58      0.64      0.61      1053
                 Symbolism       0.50      0.51      0.51       679
          Synthetic_Cubism       0.61      0.62      0.62        32
                   Ukiyo_e       0.95      0.93      0.94       175

                  accuracy                           0.60     12217
                 macro avg       0.59      0.61      0.60     12217
              weighted avg       0.61      0.60      0.60     12217


🏁 All configured models processed.
